{"contract_version":"patent-research.v2","artifact_type":"TimelineAnalysis","report_label":"专利公开文献轨迹","corpus_id":"sha256:0000000000000000000000000000000000000000000000000000000000000000","date_basis":"publication_date","cutoff":"2026-07-17","slices":[{"slice_id":"2020-2026","start":"2020-01-01","end":"2026-07-17","document_pns":["CN1A"],"route_ids":["route-1"],"evidence_ids":["sha256:1111111111111111111111111111111111111111111111111111111111111111"]}],"changes":[],"biases":["publication lag"],"search_gap_requests":[]}
